date,type,check_num,payee,memo,envelope,account,amount
"Oct 21, 2011",Withdrawal,,Lookout Joe's,Coffee break,Dining,US Bank Credit Card,-2.50
"Oct 21, 2011",Withdrawal,,Ramundo's Pizzeria and Deli,Dinner,Dining,US Bank Credit Card,-6.00
"Oct 21, 2011",Deposit,,Warren and Christa Harrison,Big check from somewhere,,US Bank Checking,"5,000.00"
"Oct 22, 2011",Withdrawal,,Ikea Food,Small lunch,Dining,US Bank Credit Card,-3.25
"Oct 22, 2011",Withdrawal,,Ikea,,New House,US Bank Credit Card,-239.99